results/estimates.csv

Strategy,Confidence,VaR,ES,ES/VaR Ratio,VaR_Lo,VaR_Hi,ES_Lo,ES_Hi,VaR (EUR),ES (EUR),VaR_Lo (EUR),VaR_Hi (EUR),ES_Lo (EUR),ES_Hi (EUR)
Historical,0.95,0.011168250440441499,0.018167162804657667,1.6266793891791964,0.010547071593052263,0.011846566302131219,0.016917319761233205,0.01955480697245784,11168.2504404415,18167.162804657666,10547.071593052264,11846.56630213122,16917.319761233204,19554.80697245784
Parametric,0.95,0.012442722712610441,0.015737312998224073,1.26478049553211,0.011741577348160304,0.01316497753843021,0.014891295736335648,0.01666335917002409,12442.72271261044,15737.312998224073,11741.577348160305,13164.97753843021,14891.295736335647,16663.35917002409
Monte Carlo (Normal),0.95,0.012447712347404473,0.015746140933580014,1.2649827128165692,0.011618717991000104,0.013035798512494154,0.014718046208705227,0.016462434313303593,12447.712347404473,15746.140933580014,11618.717991000103,13035.798512494153,14718.046208705227,16462.434313303595
Monte Carlo (t),0.95,0.009788445314934158,0.016889210572769094,1.7254231933033688,0.008992698463453718,0.010139546282070222,0.015606887996590948,0.017432590720897118,9788.445314934159,16889.210572769094,8992.698463453718,10139.546282070223,15606.88799659095,17432.59072089712
Historical,0.99,0.021438340956754877,0.03206094733661925,1.495495728950862,0.019219595722683436,0.024628485661354064,0.028108057997774823,0.03628239147001563,21438.340956754877,32060.947336619254,19219.595722683436,24628.485661354065,28108.057997774824,36282.39147001563
Parametric,0.99,0.01781593079475657,0.02048770593960881,1.1499655098367676,0.016877779957825675,0.018867971481308712,0.01941894724840632,0.021701799200393133,17815.93079475657,20487.705939608808,16877.779957825675,18867.971481308712,19418.94724840632,21701.799200393132
Monte Carlo (Normal),0.99,0.01781660004195308,0.020467428641548123,1.1487842008774451,0.016696173875187743,0.018656507135186653,0.01918914684758666,0.021432418030320956,17816.60004195308,20467.428641548122,16696.173875187742,18656.507135186654,19189.14684758666,21432.418030320954
Monte Carlo (t),0.99,0.019779061389076504,0.03195477769861401,1.6155861529537423,0.01814039195690861,0.020312168452041958,0.02952603162307548,0.03284231800881717,19779.061389076505,31954.77769861401,18140.39195690861,20312.16845204196,29526.03162307548,32842.31800881717

README.md

### Interpretation

In order to better quantify the VaR and ES figures, a nominal total portfolio value of €1 million will be considered. This means that according to the historical method the total VaR at 95 % (1.117 %) is €11,168; ES  (1.817 %) is €18,167. At 99 % the Var and ES are (2.144 %) €21,438 and (3.206 %) €32,061. Since these values are derived empirically from the data with no *a priori* assumptions about the underlying distibution, these values serve as a useful reference against which we can compare the other approaches. Looking first to the parametric method and its assumption of normality, the 95 % VaR of €12,443 is an 11.4 % over estimation, and the 99 % VaR of €17,816 is a 17 % underestimation. This is further evidence of the Gaussian distribution being an incorrect match for the shape of the returns data. The implications this has for the ES is drastic, with the ES at 99 % being a 36 % understatement (2.05 % for the parametric vs. 3.21 % for the historical). This means that 1 % of the time the average losses will be far greater than expected under the parametric scheme.

Looking to the Monte-Carlo framework, the method which leveraged a Gaussian to provide the random samples of correlated returns matches the VaR and ES of the parametric in both the 95 % and 99 % levels, confirming the underlying machinery is working since they rely on the same assumption of normality. With this framework validated, the results from then Student-t distribution can be discussed. There is much better agreement on the ES at 99 % compared to the historical method, 3.195 % vs. 3.206 %, however the stretching of the distribution to account for the tail losses has the effect of thinning the body of the curve, resulting in a 12 % underestimation of the VaR at 95 % when compared to the historical.