results/window_sensitivity.csv

Window,n,sigma_p,Confidence,Strategy,VaR,ES
full,4966,0.007884451123534586,0.95,Historical,0.011168250440441499,0.018167162804657667
full,4966,0.007884451123534586,0.95,Parametric,0.012442722712610441,0.015737312998224073
full,4966,0.007884451123534586,0.95,Monte Carlo (Normal),0.012361922147931562,0.015645560745161664
full,4966,0.007884451123534586,0.95,Monte Carlo (t),0.009690524301314377,0.016841484484207404
full,4966,0.007884451123534586,0.99,Historical,0.021438340956754877,0.03206094733661925
full,4966,0.007884451123534586,0.99,Parametric,0.01781593079475657,0.02048770593960881
full,4966,0.007884451123534586,0.99,Monte Carlo (Normal),0.01769408400972294,0.02036386082435439
full,4966,0.007884451123534586,0.99,Monte Carlo (t),0.019713013278592616,0.032211391660557254
"2,500d",2500,0.007339764566057401,0.95,Historical,0.010272774489895586,0.017040840980481305
"2,500d",2500,0.007339764566057401,0.95,Parametric,0.011513970388321984,0.014580958395368356
"2,500d",2500,0.007339764566057401,0.95,Monte Carlo (Normal),0.011446393534464692,0.014493838057947864
"2,500d",2500,0.007339764566057401,0.95,Monte Carlo (t),0.008936078812891221,0.015670014432192528
"2,500d",2500,0.007339764566057401,0.99,Historical,0.018811001355781506,0.03072487963338939
"2,500d",2500,0.007339764566057401,0.99,Parametric,0.0165159777150805,0.019003176916319017
"2,500d",2500,0.007339764566057401,0.99,Monte Carlo (Normal),0.016440912896004453,0.018873332596813324
"2,500d",2500,0.007339764566057401,0.99,Monte Carlo (t),0.01829122984746234,0.030166349060226017
250d,250,0.005393216951054752,0.95,Historical,0.008370296584162159,0.01026657104510307
250d,250,0.005393216951054752,0.95,Parametric,0.008274507367630721,0.010528112583358938
250d,250,0.005393216951054752,0.95,Monte Carlo (Normal),0.008255404647125073,0.010459007350188383
250d,250,0.005393216951054752,0.95,Monte Carlo (t),0.006422826610999389,0.011310696284854744
250d,250,0.005393216951054752,0.99,Historical,0.01156811032964221,0.012856709133507166
250d,250,0.005393216951054752,0.99,Parametric,0.0119499536930794,0.013777533416113326
250d,250,0.005393216951054752,0.99,Monte Carlo (Normal),0.011846790254801814,0.013661592477667465
250d,250,0.005393216951054752,0.99,Monte Carlo (t),0.013147712033446068,0.021856177705435124
2008,253,0.0166273920886963,0.95,Historical,0.025102375805300378,0.038314785249904566
2008,253,0.0166273920886963,0.95,Parametric,0.027628089846179496,0.034575998279144676
2008,253,0.0166273920886963,0.95,Monte Carlo (Normal),0.027507896203171085,0.03442420149881185
2008,253,0.0166273920886963,0.95,Monte Carlo (t),0.02176032615318884,0.03681200345363607
2008,253,0.0166273920886963,0.99,Historical,0.05048507587671857,0.05361186639612033
2008,253,0.0166273920886963,0.99,Parametric,0.0389595618987253,0.0445940255044019
2008,253,0.0166273920886963,0.99,Monte Carlo (Normal),0.038822692696660464,0.044337776201758335
2008,253,0.0166273920886963,0.99,Monte Carlo (t),0.04287705142132465,0.06879151792789293
2020,253,0.013819108252396045,0.95,Historical,0.018214486972644984,0.03466813835470443
2020,253,0.013819108252396045,0.95,Parametric,0.021846762691089358,0.02762120394144959
2020,253,0.013819108252396045,0.95,Monte Carlo (Normal),0.02175035722277562,0.027462847395778943
2020,253,0.013819108252396045,0.95,Monte Carlo (t),0.017063713188107822,0.029739692711532997
2020,253,0.013819108252396045,0.99,Historical,0.047915723678340114,0.056659811709272395
2020,253,0.013819108252396045,0.99,Parametric,0.03126440546500248,0.03594723618768472
2020,253,0.013819108252396045,0.99,Monte Carlo (Normal),0.031056578334300696,0.0357665517834142
2020,253,0.013819108252396045,0.99,Monte Carlo (t),0.035082365084326626,0.0571148295923667
2009-19,2768,0.006348205467924931,0.95,Historical,0.009714003396543077,0.014614299610028381
2009-19,2768,0.006348205467924931,0.95,Parametric,0.009892514698644904,0.012545170633472841
2009-19,2768,0.006348205467924931,0.95,Monte Carlo (Normal),0.009828534495223938,0.012475070775637942
2009-19,2768,0.006348205467924931,0.95,Monte Carlo (t),0.00766311518733567,0.013408458838984779
2009-19,2768,0.006348205467924931,0.99,Historical,0.01850985416193242,0.02250040892500698
2009-19,2768,0.006348205467924931,0.99,Parametric,0.014218780204377017,0.016369973396885937
2009-19,2768,0.006348205467924931,0.99,Monte Carlo (Normal),0.01416847635559859,0.016261880526369118
2009-19,2768,0.006348205467924931,0.99,Monte Carlo (t),0.01567385457872985,0.025702179547635196

README.md

### Interpretation

In order to better quantify the VaR and ES figures, a nominal total portfolio value of €1 million will be considered. This means that according to the historical method the total VaR at 95 % (1.117 %) is €11,168; ES  (1.817 %) is €18,167. At 99 % the Var and ES are (2.144 %) €21,438 and (3.206 %) €32,061. Since these values are derived empirically from the data with no *a priori* assumptions about the underlying distibution, these values serve as a useful reference against which we can compare the other approaches. Looking first to the parametric method and its assumption of normality, the 95 % VaR of €12,443 is an 11.4 % over estimation, and the 99 % VaR of €17,816 is a 17 % underestimation. This is further evidence of the Gaussian distribution being an incorrect match for the shape of the returns data. The implications this has for the ES is drastic, with the ES at 99 % being a 36 % understatement (2.05 % for the parametric vs. 3.21 % for the historical). This means that 1 % of the time the average losses will be far greater than expected under the parametric scheme.

Looking to the Monte-Carlo framework, the method which leveraged a Gaussian to provide the random samples of correlated returns matches the VaR and ES of the parametric in both the 95 % and 99 % levels, confirming the underlying machinery is working since they rely on the same assumption of normality. With this framework validated, the results from then Student-t distribution can be discussed. There is much better agreement on the ES at 99 % compared to the historical method, 3.195 % vs. 3.206 %, however the stretching of the distribution to account for the tail losses has the effect of thinning the body of the curve, resulting in a 12 % underestimation of the VaR at 95 % when compared to the historical.